
05.09.2025,🚀 Продажи и маркетинг,RAIN Group Sales Blog,Реклама,Запустить таргетированную рекламу в соцсетях с акцентом на профессиональный рост массажистов через онлайн-обучение и получение навыков консультативных продаж в сфере массажа,8,8,8,https://www.rainsalestraining.com/blog/ai-will-transform-selling,Использование темы профессионального роста и актуальности навыков в продажах стимулирует интерес целевой аудитории массажистов и потенциальных учеников онлайн-школы массажа. Реклама с четким УТП поможет быстро собрать лидов с минимальными бюджетными затратами.
05.09.2025,🚀 Продажи и маркетинг,RAIN Group Sales Blog,Воронка,"Добавить в воронку продажи бесплатный мини-курс или вебинар по тому, как использовать навыки консультативных продаж для продвижения своих услуг массажа",7,9,8.2,https://www.rainsalestraining.com/blog/ai-will-transform-selling,"Такой лид-магнит не только привлечет больше заинтересованных учеников, но и сразу покажет ценность обучения — возможность увеличить свой доход и компетенции в продажах, что резко повышает конверсию в платные курсы."
05.09.2025,🚀 Продажи и маркетинг,RAIN Group Sales Blog,Продукт,"Переработать продукт, внедрив в курсы разделы по консультативным продажам и построению доверительных отношений с клиентами, чтобы онлайн-курсы массажа не только давали технические навыки, но и развивали навыки стратегического общения",6,9,7.8,https://www.rainsalestraining.com/blog/ai-will-transform-selling,"Обучение массажу обычно сосредоточено на технике, а интеграция продаж повысит общий профессиональный уровень слушателей, сделает их более успешными специалистами, что усилит репутацию школы и увеличит количество рекомендаций."
05.09.2025,🚀 Продажи и маркетинг,RAIN Group Sales Blog,Реклама,"Создать серию коротких видеороликов с примерами, как лучшие специалисты по массажу строят доверие и выявляют потребности клиента, используя навыки консультативных продаж, и продвигать эти ролики через Instagram и TikTok",9,7,7.800000000000001,https://www.rainsalestraining.com/blog/ai-will-transform-selling,"Высокая вовлеченность форматов коротких видео и популярность этих платформ позволит быстро набрать аудиторию с бесплатным бюджетом, а предоставление ценных кейсов вызовет доверие и интерес к школе."
05.09.2025,🚀 Продажи и маркетинг,RAIN Group Sales Blog,Воронка,"Включить в воронку продаж интерактивный опрос/тест с оценкой текущих навыков продаж и общения массажиста, после чего предложить персонализированные рекомендации по обучению из продуктовой линейки онлайн-школы массажа",6,8,7.2,https://www.rainsalestraining.com/blog/ai-will-transform-selling,"Интерактивные элементы повышают вовлеченность, позволяют сегментировать аудиторию по уровню и предлагать наиболее релевантные предложения, повышая конверсию и эффективность узконаправленных рекламных кампаний."
05.09.2025,🚀 Продажи и маркетинг,ClickFunnels,Воронка,"Добавить воронку с upsell-предложением сразу после покупки базового онлайн-курса массажа, например, предложение индивидуальной консультации по техникам массажа или расширенного курса углубленной практики.",8,9,8.6,https://www.clickfunnels.com/blog/how-to-maximize-coaching-sales-with-smart-upsells/,"Добавление upsell после первой покупки максимально эффективно — клиент уже в состоянии доверия и мотивации, плюс это увеличивает средний чек без значительных затрат и усилий."
05.09.2025,🚀 Продажи и маркетинг,ClickFunnels,Продукт,Создать мини-курс или серию видеороликов с углубленными техниками массажа как upsell для выпускников базового курса с возможностью продажи через автоматическую email-рассылку и страницы благодарности.,7,8,7.6,https://www.clickfunnels.com/blog/how-to-maximize-coaching-sales-with-smart-upsells/,"Мини-курсы легко производить и масштабировать, не требуют постоянного вовлечения, отлично дополняют основной продукт и помогают увеличивать доход при небольших затратах."
05.09.2025,🚀 Продажи и маркетинг,ClickFunnels,Реклама,Запустить таргетированную рекламу с акцентом на бесплатный вебинар по базовым техникам массажа с последующим предложением платного расширенного курса и upsell в виде индивидуального разбора ошибок.,6,9,7.8,https://www.clickfunnels.com/blog/how-to-maximize-coaching-sales-with-smart-upsells/,"Вебинар хорошо конвертирует, помогает установить доверие и дает логичный переход к upsell-оферу, а бюджет $2000 достаточно для качественного продвижения в соцсетях."
05.09.2025,🚀 Продажи и маркетинг,ClickFunnels,Продукт,"Добавить в продукт бонусные материалы (шаблоны массажных программ, чек-листы для клиентов) как upsell, который автоматически доступен после покупки основного курса массажа.",9,7,7.800000000000001,https://www.clickfunnels.com/blog/how-to-maximize-coaching-sales-with-smart-upsells/,"Бонусы легко создатсья и воспринимаются клиентами как ценность, увеличивают удовлетворенность и мотивируют сделать доппокупку без значительных вложений."
05.09.2025,🚀 Продажи и маркетинг,ClickFunnels,Воронка,"Оптимизировать страницу благодарности после покупки курса, добавив там продуманное предложение с upsell, например, доступ в закрытую группу поддержки или мастермайнд по массажу.",8,8,8,https://www.clickfunnels.com/blog/how-to-maximize-coaching-sales-with-smart-upsells/,"Страница благодарности — оптимальное место для upsell, поскольку пользователь уже совершил покупку и открыт к дополнительным предложениям, что повышает конверсию с минимальными трудозатратами."
05.09.2025,📚 EdTech,eLearning Industry,Реклама,Запустить таргетированную рекламу в соцсетях с акцентом на уникальные возможности персонализации обучения в нашей онлайн-школе массажа благодаря анализу и учету индивидуальных особенностей учеников.,8,8,8,https://elearningindustry.com/why-edtech-companies-need-data-enrichment-to-drive-smarter-ai-powered-learning,"Демонстрация глубокого уровня персонализации и внимательного подхода к разным стилям обучения привлечет аудиторию, заинтересованную в эффективном обучении массажу онлайн. Настроить таргетинг и собрать трафик — относительно просто в рамках бюджета."
05.09.2025,📚 EdTech,eLearning Industry,Воронка,Добавить в воронку квиз-опрос о предпочтениях и уровне знаний по массажу для сбора данных и последующей персонализации предложений курса.,7,9,8.2,https://elearningindustry.com/why-edtech-companies-need-data-enrichment-to-drive-smarter-ai-powered-learning,"Собранные данные позволят адаптировать рассылки и предложения под реальные нужды учеников, увеличить конверсию в покупку и улучшить удержание без привлечения сторонних разработчиков."
05.09.2025,📚 EdTech,eLearning Industry,Продукт,"Внедрить систему адаптивных заданий и тестов с вариативной сложностью, учитывая результаты и степень освоения тем, для повышения вовлеченности учеников и качества усвоения материала.",6,9,7.8,https://elearningindustry.com/why-edtech-companies-need-data-enrichment-to-drive-smarter-ai-powered-learning,"Адаптация контента под уровень знаний повысит удовлетворенность курсом и результаты учеников, что увеличит положительные отзывы и рекомендации. Реализуется с помощью имеющихся платформенных возможностей или легких no-code решений."
05.09.2025,📚 EdTech,eLearning Industry,Воронка,"Настроить автоматические email-рассылки с рекомендациями по конкретным урокам и дополнительным материалам, основанным на поведении и результатах обучения каждого пользователя.",9,8,8.4,https://elearningindustry.com/why-edtech-companies-need-data-enrichment-to-drive-smarter-ai-powered-learning,Персонализированные советы способствуют более глубокому вовлечению и помогают ученикам проходить курс до конца. Инструменты email-маркетинга с триггерными рассылками легко настроить без команды разработчиков.
05.09.2025,📚 EdTech,eLearning Industry,Продукт,"Создать бесплатный мини-курс на основе анализа потребностей целевой аудитории, демонстрирующий персонализированный подход с элементами геймификации и адаптивного обучения.",7,8,7.6,https://elearningindustry.com/why-edtech-companies-need-data-enrichment-to-drive-smarter-ai-powered-learning,"Такой продукт привлечет новую аудиторию, позволит собрать данные для последующего таргетинга и повысит доверие к онлайн-школе массажа, эффективно запуская продажи основных курсов."
05.09.2025,💆‍♂️ Массаж,Discover Massage Australia,Реклама,"Запустить таргетированную рекламу в социальных сетях с акцентом на выпускников курсов DMA, предлагая бесплатный вебинар по построению успешной карьеры массажиста в Аделаиде.",8,8,8,https://www.discovermassage.com.au/blog/launching-a-successful-massage-career-in-adelaide-after-dma-courses/,"Таргетированная реклама позволит быстро достигнуть аудитории заинтересованных выпускников DMA без необходимости создавать сложные разработки. Бесплатный вебинар привлечёт лиды и повысит доверие к школе массажа, что ведет к росту заявок."
05.09.2025,💆‍♂️ Массаж,Discover Massage Australia,Воронка,Добавить в воронку продаж серию автоматических email-рассылок с полезными советами по запуску карьеры массажиста и ссылками на дополнительное обучение и сертификаты.,7,9,8.2,https://www.discovermassage.com.au/blog/launching-a-successful-massage-career-in-adelaide-after-dma-courses/,"Автоматизация email-маркетинга поможет поддерживать заинтересованность и постепенно прогревать потенциальных клиентов, увеличивая конверсию без больших затрат и ресурсов."
05.09.2025,💆‍♂️ Массаж,Discover Massage Australia,Продукт,"Создать мини-курс или чек-лист по практическим шагам для запуска карьеры массажиста после окончания DMA с рекомендациями по сертификациям, работе с клиентами и страхованию.",7,8,7.6,https://www.discovermassage.com.au/blog/launching-a-successful-massage-career-in-adelaide-after-dma-courses/,"Такой продукт повысит ценность основной образовательной программы, поможет студентам чувствовать себя увереннее и может стать дополнительным источником дохода или инструментом удержания."
05.09.2025,💆‍♂️ Массаж,Discover Massage Australia,Реклама,Провести рекламную кампанию с отзывами успешных выпускников курсов DMA с акцентом на возможности карьерного роста и востребованность массажа в Аделаиде.,8,7,7.4,https://www.discovermassage.com.au/blog/launching-a-successful-massage-career-in-adelaide-after-dma-courses/,"Отзывы реальных выпускников создают доверие и мотивируют потенциальных клиентов пройти обучение, при этом такие материалы легко собрать и использовать в соцсетях и рекламе."
05.09.2025,💆‍♂️ Массаж,Discover Massage Australia,Продукт,Встроить в сайт онлайн-школы интерактивный калькулятор доходности карьерного роста массажиста в Аделаиде после курса DMA для мотивации записываться на обучение.,5,8,6.8,https://www.discovermassage.com.au/blog/launching-a-successful-massage-career-in-adelaide-after-dma-courses/,"Хотя потребует немного технической работы, калькулятор даст пользователям наглядное понимание будущих возможностей, стимулируя принятие решения об обучении."
05.09.2025,💆‍♂️ Массаж,Discover Massage Australia,Реклама,Создать серию сторис/рилейсов с советами от преподавателей и успешных студентов про шаги после курсов DMA и продвижение услуг массажа в Аделаиде.,9,7,7.800000000000001,https://www.discovermassage.com.au/blog/launching-a-successful-massage-career-in-adelaide-after-dma-courses/,"Контент в формате коротких видео легко производить без затрат на команду и он позволяет неформально и убедительно общаться с аудиторией, стимулируя интерес к обучению."
05.09.2025,💆‍♂️ Массаж,Discover Massage Australia,Воронка,Включить в подписочную рассылку еженедельные обзоры новых вакансий и возможностей стажировок в массажных центрах Аделаиды для выпускников DMA.,8,7,7.4,https://www.discovermassage.com.au/blog/launching-a-successful-massage-career-in-adelaide-after-dma-courses/,"Подписчики получат ценную информацию о рынке труда в индустрии массажа, что повысит лояльность и мотивацию проходить обучение именно в вашей школе."
05.09.2025,🚀 Продажи и маркетинг,RAIN Group Sales Blog,Реклама,"Запустить рекламную кампанию с акцентом на уникальную экспертность преподавателей и создание ценности через онлайн-обучение массажу, а не только на автоматизацию и технологические «фишки». Использовать короткие видео с рассказами преподавателей и учеников о реальной пользе курса.",8,9,8.6,https://www.rainsalestraining.com/blog/ai-will-transform-selling,"Показывая ценность и экспертность убедим потенциальных студентов, что обучение в нашей онлайн-школе — это не просто набор видеоуроков, а полноценный путь к экспертности и пониманию клиентов. Такой подход способствует лучшему вовлечению и мотивации покупателей."
05.09.2025,🚀 Продажи и маркетинг,RAIN Group Sales Blog,Воронка,"Внедрить воронку с бесплатным мини-курсом или вводным уроком, который демонстрирует реальные практические навыки и помогает потенциальным клиентам оценить качество обучения, создавая доверие и стимулируя дальнейшее продолжение обучения.",7,10,8.8,https://www.rainsalestraining.com/blog/ai-will-transform-selling,"Бесплатный вводный урок снижает барьер входа, позволяет привлечь больше людей и выявить заинтересованных покупателей, которые ценят живую и экспертную подачу материала."
05.09.2025,🚀 Продажи и маркетинг,RAIN Group Sales Blog,Продукт,"Создать продукт - интенсивный 2-недельный онлайн-курс с сессиями обратной связи от преподавателей, уделяя особое внимание выявлению индивидуальных потребностей ученика и адаптации обучающего плана под них.",6,8,7.2,https://www.rainsalestraining.com/blog/ai-will-transform-selling,"Персонализация обучения и внимание к потребностям клиента значительно увеличивают восприятие ценности курса, что повышает конверсию и удовлетворенность учеников."
05.09.2025,🚀 Продажи и маркетинг,RAIN Group Sales Blog,Реклама,"Настроить рекламу с упором на стратегический подход к обучению массажа — как умение выявлять реальные потребности клиентов и налаживать с ними доверительные отношения, а не просто технические навыки, что поможет добиться успеха в профессии.",7,8,7.6,https://www.rainsalestraining.com/blog/ai-will-transform-selling,"Так как AI и автоматизация не заменят человеческого подхода, акцент на стратегии и коммуникации привлечет более мотивированную и целевую аудиторию."
05.09.2025,🚀 Продажи и маркетинг,RAIN Group Sales Blog,Воронка,"Добавить в воронку этап индивидуальной консультации или разбор кейсов с преподавателем после прохождения бесплатного урока, чтобы помочь пользователю увидеть свое развитие и необходимость дальнейшего обучения.",5,9,7.3999999999999995,https://www.rainsalestraining.com/blog/ai-will-transform-selling,Персональное взаимодействие повышает вовлеченность и вероятность покупки полного курса при минимальных ресурсах и бюджете.
05.09.2025,🚀 Продажи и маркетинг,ClickFunnels,Воронка,"Добавить воронку upsell после основной продажи курса массажа, предлагая дополнительный видеокурс по глубоким техникам массажа или персональные консультации по коррекции техники.",8,9,8.6,https://www.clickfunnels.com/blog/how-to-maximize-coaching-sales-with-smart-upsells/,"Легко внедряется без команды разработчиков, главное — адаптировать существующий поток продаж и добавить предложение для участников, которые уже купили основной курс. Это увеличит средний чек и позволит масштабироваться без дополнительных звонков."
05.09.2025,🚀 Продажи и маркетинг,ClickFunnels,Реклама,Запустить рекламу в соцсетях с предложением основного бесплатного мини-курса или вебинара по массажу с последующим предложением платного расширенного курса или персональной поддержки.,7,8,7.6,https://www.clickfunnels.com/blog/how-to-maximize-coaching-sales-with-smart-upsells/,"Привлечет новых клиентов воронку, где можно внедрить upsell. Бюджет $2000 позволяет организовать таргетированную рекламу, а через 2 недели уже можно оценить эффективность и изучить спрос на дополнительные услуги."
