
05.09.2025,🚀 Продажи и маркетинг,ClickFunnels,Продукт,"Добавить в онлайн-школу раздел с шаблонами и готовыми чек-листами по массажу, которые продаются как отдельный недорогой продукт после основного курса.",9,7,7.800000000000001,https://www.clickfunnels.com/blog/how-to-maximize-coaching-sales-with-smart-upsells/,"Небольшой цифровой продукт легко создать и интегрировать в текущий учебный процесс. Он усилит ценность основного курса и позволит заработать дополнительный доход, не тратя много времени на поддержку."
05.09.2025,🚀 Продажи и маркетинг,ClickFunnels,Воронка,"Создать серию обучающих email-рассылок с полезными советами, а через 5-7 дней предложить расширенный курс или индивидуальный разбор ошибок учеников как upsell.",8,8,8,https://www.clickfunnels.com/blog/how-to-maximize-coaching-sales-with-smart-upsells/,Автоматизация email-маркетинга — простой способ увеличить продажи с минимальными затратами и без технической команды. Правильно выстроенный триггерный сценарий повышает конверсию и удерживает клиента внутри школы.
05.09.2025,🚀 Продажи и маркетинг,ClickFunnels,Продукт,Внедрить в продукт пакет ‘групповой менторинг’ или доступ в чат для вопросов эксперту как дополнительную опцию к основному курсу массажа.,7,9,8.2,https://www.clickfunnels.com/blog/how-to-maximize-coaching-sales-with-smart-upsells/,"Групповой формат позволяет масштабировать поддержку без значительного увеличения ресурсов, а клиенты получают дополнительную ценность. Это повышает лояльность и средний чек при относительно низких затратах."
05.09.2025,📚 EdTech,eLearning Industry,Воронка,"Создать страницу с отзывами студентов и мастеров на сайте школы массажа, акцентируя внимание на реальных историях успеха и конкретных навыках, которые они получили",8,9,8.6,https://elearningindustry.com/why-software-review-platforms-drive-sales-how-to-get-more-testimonials-for-your-product,"Подробные отзывы повышают доверие новых клиентов и мотивируют записаться на курс, при этом реализуемы без привлечения программистов и с минимальными затратами."
05.09.2025,📚 EdTech,eLearning Industry,Реклама,Запустить таргетированную рекламу в соцсетях с предложением оставить отзыв и получить бонус или скидку на следующий курс массажа,7,8,7.6,https://elearningindustry.com/why-software-review-platforms-drive-sales-how-to-get-more-testimonials-for-your-product,"Мотивированные студенты охотнее делятся отзывами, а бонус стимулирует повторные продажи. Бюджет до $2000 позволит охватить достаточно целевой аудитории за 2 недели."
05.09.2025,📚 EdTech,eLearning Industry,Продукт,Собрать и опубликовать видеоотзывы выпускников с демонстрацией своих навыков массажа,6,9,7.8,https://elearningindustry.com/why-software-review-platforms-drive-sales-how-to-get-more-testimonials-for-your-product,"Видеоотзывы создают глубокое доверие и социал-пруф, что увеличит конверсию, при этом съёмка и монтаж можно выполнить самостоятельно с минимальным оборудованием."
05.09.2025,📚 EdTech,eLearning Industry,Воронка,Добавить на сайт раздел сравнения разных курсов массажа с отзывами и рейтингами для помощи потенциальным студентам в выборе,6,8,7.2,https://elearningindustry.com/why-software-review-platforms-drive-sales-how-to-get-more-testimonials-for-your-product,"Помогая клиенту сравнить предложения и увидеть реальные оценки, увеличивается вероятность выбора вашей школы, улучшая SEO и удержание на сайте."
05.09.2025,📚 EdTech,eLearning Industry,Продукт,Записать серию кратких обучающих вебинаров с приглашением после их просмотра оставить отзыв и поделиться впечатлениями,7,7,7,https://elearningindustry.com/why-software-review-platforms-drive-sales-how-to-get-more-testimonials-for-your-product,Вебинары поддерживают интерес и дают возможность получить качественные отзывы от вовлечённых слушателей без значительных вложений.
05.09.2025,📚 EdTech,eLearning Industry,Реклама,Разместить отзывы и рейтинги вашей школы на популярных специализированных образовательных и wellness платформах,7,8,7.6,https://elearningindustry.com/why-software-review-platforms-drive-sales-how-to-get-more-testimonials-for-your-product,"Публикация на нишевых площадках повышает видимость и доверие именно целевой аудитории, что приводит к росту трафика и продаж без необходимости технической поддержки."
05.09.2025,📚 EdTech,eLearning Industry,Воронка,Автоматизировать сбор отзывов через email-рассылку с простой формой опроса сразу после окончания курса,8,8,8,https://elearningindustry.com/why-software-review-platforms-drive-sales-how-to-get-more-testimonials-for-your-product,Автоматизированный сбор отзывов увеличит число качественных отзывов без дополнительной рабочей нагрузки и затрат.
05.09.2025,📚 EdTech,eLearning Industry,Реклама,Запустить таргетированную рекламу в соцсетях с видеообъяснением пользы индивидуальных планов обучения на базе анализа поведения учеников,8,9,8.6,https://elearningindustry.com/why-edtech-companies-need-data-enrichment-to-drive-smarter-ai-powered-learning,"Видео наглядно показывает уникальность подхода школы, повышая доверие и кликабельность рекламы при относительно низкой стоимости производства и настройки таргета."
05.09.2025,📚 EdTech,eLearning Industry,Воронка,Добавить в воронку сегментацию пользователей по уровню владения навыками и предпочтениям в обучении для персональной рассылки с рекомендованными курсами,7,8,7.6,https://elearningindustry.com/why-edtech-companies-need-data-enrichment-to-drive-smarter-ai-powered-learning,"Персонализированные письма повышают открываемость и конверсию, что улучшит вовлеченность без необходимости сложных разработок."
05.09.2025,📚 EdTech,eLearning Industry,Продукт,Создать интерактивный элемент в онлайн-курсе для самодиагностики текущих навыков массажа и рекомендаций по подходящим модулям,6,9,7.8,https://elearningindustry.com/why-edtech-companies-need-data-enrichment-to-drive-smarter-ai-powered-learning,"Это усилит ощущение индивидуального подхода и направит ученика по персональному пути, увеличивая мотивацию и удержание."
05.09.2025,📚 EdTech,eLearning Industry,Воронка,Настроить серию автоматизированных напоминаний с советами и микроуроками исходя из активности и прогресса обучающегося для повышения вовлеченности,8,8,8,https://elearningindustry.com/why-edtech-companies-need-data-enrichment-to-drive-smarter-ai-powered-learning,"Автоматизация поможет удержать учеников на протяжении курса, не требуя затрат на разработку новых функций."
05.09.2025,📚 EdTech,eLearning Industry,Реклама,Запустить рекламу с таргетом на корпоративных клиентов с предложением настройки обучающих программ под конкретные профили сотрудников и роли,7,8,7.6,https://elearningindustry.com/why-edtech-companies-need-data-enrichment-to-drive-smarter-ai-powered-learning,Бизнес-заказчики ценят кастомизацию; такая реклама привлечет заинтересованных клиентов без больших вложений.
05.09.2025,📚 EdTech,eLearning Industry,Продукт,Добавить в продукт функции адаптивного тестирования с изменением сложности и формата вопросов по результатам предыдущих ответов ученика,5,9,7.3999999999999995,https://elearningindustry.com/why-edtech-companies-need-data-enrichment-to-drive-smarter-ai-powered-learning,"Повышает качество обучения и удержания учеников, способствуя более точной самооценке и развитию навыков."
05.09.2025,📚 EdTech,eLearning Industry,Воронка,"Создать лендинг с кейсами и отзывами, где подробно рассказывать, как персонализация и данные об ученике улучшили результаты успешных студентов",9,7,7.800000000000001,https://elearningindustry.com/why-edtech-companies-need-data-enrichment-to-drive-smarter-ai-powered-learning,"Социальное доказательство повысит доверие новых пользователей, увеличив конверсию без значительных затрат."
05.09.2025,💆‍♂️ Массаж,Discover Massage Australia,Реклама,"Запуск таргетированной рекламы в соцсетях с разбором популярных массажных техник и их преимуществ, ориентированной на начинающих массажистов после курсов DMA",8,8,8,https://www.discovermassage.com.au/blog/launching-a-successful-massage-career-in-adelaide-after-dma-courses/,"Социальные сети позволяют быстро донести ценность обучения в школе массажа, сформировать доверие и привлечь целевую аудиторию без значительных вложений и труда программистов."
05.09.2025,💆‍♂️ Массаж,Discover Massage Australia,Воронка,"Создание бесплатного мини-курса или серии видео по ключевым навыкам массажа и запуска карьер после DMA, чтобы вовлечь подписчиков и собрать базу потенциальных клиентов",7,9,8.2,https://www.discovermassage.com.au/blog/launching-a-successful-massage-career-in-adelaide-after-dma-courses/,"Бесплатный образовательный контент легко производить с минимальными затратами и помогает собирать контактные данные, а также стимулирует доверие и переход на платные программы."
05.09.2025,💆‍♂️ Массаж,Discover Massage Australia,Воронка,"Оптимизация лендинга с чётким описанием преимуществ курсов, отзывами выпускников и призывом к действию — записаться на консультацию или курс",9,7,7.800000000000001,https://www.discovermassage.com.au/blog/launching-a-successful-massage-career-in-adelaide-after-dma-courses/,Улучшение текущего сайта поможет увеличить конверсию посетителей в учеников без значительных вложений и привлечения разработчиков.
05.09.2025,💆‍♂️ Массаж,Discover Massage Australia,Воронка,"Запуск рассылки с серией полезных советов для новичков в массаже, кейсов выпускников и обучающего контента с призывом записаться на курсы или консультацию",7,8,7.6,https://www.discovermassage.com.au/blog/launching-a-successful-massage-career-in-adelaide-after-dma-courses/,Email-маркетинг имеет высокий ROI и позволяет постепенно прогревать аудиторию без больших затрат и сложностей.
05.09.2025,💆‍♂️ Массаж,Discover Massage Australia,Продукт,"Внедрение модуля наставничества в онлайн-школу, где выпускники могут получать поддержку и рекомендации по продвижению своего бизнеса массажа после курсов",6,9,7.8,https://www.discovermassage.com.au/blog/launching-a-successful-massage-career-in-adelaide-after-dma-courses/,"Добавление поддержки позволит повысить удовлетворённость учеников и увеличить ценность продукта, мотивируя учеников рекомендовать школу и возвращаться за новыми курсами."
05.09.2025,💆‍♂️ Массаж,Discover Massage Australia,Реклама,Проведение интерактивного онлайн-вебинара с разбором карьеры и ответа на вопросы по запуску массажа после DMA с призывом к действию на регистрацию в школу,8,8,8,https://www.discovermassage.com.au/blog/launching-a-successful-massage-career-in-adelaide-after-dma-courses/,"Вебинары повышают доверие и позволяют напрямую коммуницировать с целевой аудиторией, получить обратную связь и закрыть продажи с минимальными затратами."
05.09.2025,💆‍♂️ Массаж,Discover Massage Australia,Воронка,Создание чек-листа или гайда с пошаговыми инструкциями по запуску карьер массажа в Аделаиде после курсов DMA для сбора лидов,9,7,7.800000000000001,https://www.discovermassage.com.au/blog/launching-a-successful-massage-career-in-adelaide-after-dma-courses/,"Простой в изготовлении цифровой продукт с высокой полезностью для целевой аудитории, помогающий собирать контакты и подогревать интерес."
